{
  "schemaVersion": "1.0",
  "formatVersion": "1.0",
  "metadata": {
    "title": "Project state example",
    "type": "project-state",
    "updated": "2026-06-05"
  },
  "nodes": [
    {
      "id": "formal-release",
      "title": "Formal release",
      "tags": [
        "release",
        "status"
      ],
      "fields": {
        "status": "active",
        "owner": "maintainers",
        "purpose": "Track readiness for the first public open-source release.",
        "current": [
          "Parser, schema, CLI, conformance fixtures, and package checks are active.",
          "Viewer and editor integrations remain on the release path."
        ],
        "ai_task": "Summarize blockers and propose next verification steps.",
        "ai_boundary": "Keep unreleased project names out of public-facing text.",
        "risk": [
          "Shipping before examples and viewer are complete may weaken adoption."
        ],
        "verify": [
          "Run npm run release:check.",
          "Confirm every official example validates and exports."
        ],
        "history": [
          "2026-06-05 aligned public naming and package scope."
        ]
      },
      "children": [
        {
          "id": "toolchain",
          "title": "Toolchain",
          "tags": [
            "cli",
            "packages"
          ],
          "fields": {
            "status": "active",
            "depends_on": "[[formal-release]]",
            "acceptance": [
              "Packages install from tarballs.",
              "CLI validates and exports examples."
            ]
          },
          "children": [
            {
              "id": "release-gate",
              "title": "Release gate",
              "tags": [
                "ci"
              ],
              "fields": {
                "purpose": "Keep release checks deterministic.",
                "verify": [
                  "Public surface scan passes.",
                  "Publish dry run passes."
                ]
              },
              "children": []
            }
          ]
        }
      ]
    }
  ]
}
